rule id,rule
351c71773b27413215964cddeaec2086,The output must include the app's Name and Subtitle as separate fields.
97d812873bf4b9713bbe88ec4ed07e3e,"The output's Description must end with the app's help email, URLs for Terms of Use, Privacy Policy, and License."
872c5b3c254cc4898acf64b916aaf969,"If the app has a previous version, the output must include a section titled ""What's new in this version""."
c4fbeaa3cede2b35a51f9a85e79d3f03,The output must include Keywords relevant to the app for App Store Optimization (ASO).
6d063127348ea3b93df3ee2d84070628,"All images must be resized to specific sizes without distortion, ensuring they use aspect fill to maintain quality."
a553486a0d317ebba4c468057013f6ca,"The provided screenshots and videos must fit the requirements of the iPhone 6.5, iPhone 5.5, and iPad 12.9 displays, with both portrait and landscape options listed in the prompt."
0e9bfe7c2eb4596c5422a34cf90e1303,"The promotional video must be composed of 3-4 frames that include screenshots and new sales copy, compiled into a single video."
16594da55a753cc198712e9b6b6bb698,A download link must be provided for a zipped folder containing all the created images.
