rule id,rule
3e856ca99f23e5206d1d64809d183681,The output must showcase Japanese women in the images.
326661f07dc22eb2dbe53df29651d77f,The images generated must adhere to a photographic level of realism.
5252bd06284210bd103e1e10c906f816,Anime-like representations are not acceptable in the output images.
173afa9a6d602b7fb674b620fb6cd916,"The LLM must adhere to user-specified preferences regarding hair length, hair color, facial features, and clothing style."
a698250dfe473eb85bcb525489b2db94,The output must clearly differentiate between 'cute' and 'elegant' styles based on user selection.
