rule id,rule
6071a643b2742aa0a38945cd3fd488e6,The output must provide guidance on identifying and attracting top cybersecurity talent.
5c5ac938428e74969a10a60765dfa492,The output must include information on skills assessment for cybersecurity positions.
b48d5b5c4791a59038f38c453c069ce7,The output must offer advice on formulating job descriptions for cybersecurity roles.
a50ed73dc805d9e7031f11fac50d2515,The output must suggest effective recruitment channels for hiring cybersecurity professionals.
29df735e772da507bc1e2302a5438891,The output must provide advice on building a balanced and diverse cybersecurity team.
bb17f51ba637a9fdd60ead9be8dcc742,The output must consider various skill sets when discussing team composition.
27251f0e87b8b469267ca241da7ba5ed,The output must consider various experience levels when discussing team composition.
08f7e98d9b269ca82db41c9a54ffdb2a,The output must consider various perspectives when discussing team composition to enhance team effectiveness.
9892a58d42c70e459646ef7995fcf131,The output must include recommendations on cybersecurity training programs.
bc441e3efacf4b7a55e60007357f4c43,The output must include recommendations on skill development strategies relevant to current cybersecurity trends and technologies.
dfe8fa4ff8cf85a8ceb4fa892cddd7ff,The output must provide insights into fostering a collaborative cybersecurity team environment.
ad7a6a326e340bd5f08f7ae9cb70922c,The output must emphasize communication in the context of improving team dynamics.
62b9ef46935a3ff3796951ee3f058b9e,The output must emphasize role clarity in the context of improving team dynamics.
ab4b48142b55cd57b252cc6508f5dc13,The output must offer solutions for conflict resolution within cybersecurity teams.
6f11aaec4c043c0b24de43980f547313,The output must suggest effective leadership practices specific to cybersecurity teams.
02c3681ddcec97e11827c2dc45415aae,The output must suggest effective management practices specific to cybersecurity teams.
736500d9ac97e679dbb51bc248993ee0,The output must offer insights on motivational strategies for cybersecurity leaders.
42276c208b190d010bcbdc35c5f40bb4,The output must discuss performance management strategies for cybersecurity teams.
