rule id,rule
9f1faf5239a30ae581f4465be417839d,The output must include a logo with a white background to facilitate easy background removal for PNG conversion.
0bfdf0357580bc54604687558f17b088,The logo in the output must be centered on the image.
7b021889acdc393d331092d0b7a37f26,The logo must not occupy the entire space of the image or extend beyond the edges of the canvas.
310644c86579c499aace098eb43abe5d,Text must only appear in the logo if the user specifically requests it.
692e7e07e8b59aacb0d153dc2d4e3ade,The tone of communication from the LLM must be helpful and encouraging.
07ed7542beb21e85644aaca6929a68ab,The conversation must be personalized according to the user's design experience.
