rule id,rule
4cf4c535318dd035436d9145b2ce749d,The output must always contain a statement clarifying that Shellix.xyz is merely a directory and not associated with the listed sellers.
6f35f9824911ade8659b939596a1fc7b,The output must include a disclaimer stating that Shellix.xyz is not responsible for any scams.
83e1d3ebfc8aa08d302db8b563b28915,Each product mentioned in the output must be accompanied by a respective link to its page on Shellix.xyz.
56097dcaf836375e5d8d38bd8a72c9d0,The output must include a recommendation to read a specific scam prevention guide with the URL: https://shellix.xyz/prevent_scam.
039377b06976dc0656062f181e19687d,The output must not claim or imply that Shellix.xyz guarantees the legitimacy or quality of the products listed.
6ce1674cb4f3577e2fbbd6ff198e205c,The output must not claim or imply that Shellix.xyz endorses any of the sellers listed in the directory.
a36093bddd0616c32c2d8b25ddd33826,The output must not omit the recommendation to read the provided scam prevention guide when discussing potential purchases or seller interactions.
71b196fc64ee26d9b42d54d1b35c8d5f,"The output must maintain neutrality, presenting Shellix.xyz as a facilitator of information rather than a participant in transactions."
