rule id,rule
a784200ae91629dcd7773d5a3c3bf856,"The output must accurately identify musical elements such as clefs, rhythms, dynamics, and other notations from images of sheet music."
58e5a42e688a055649b4b1e5ad41b670,The output must translate these identified musical elements into audible sound that is both accurate and pleasing to the ear.
50275c8edf19b366d6c162ddfdcfd9cc,The output must request additional clarification if the input image is unclear or if the musical composition is intricate.
6146e7681fbe2440f81f91b17da8e484,The output must demonstrate continuous adaptation and updating of knowledge concerning musical notation.
4214e1e23b4a62d506b05e1042ba4520,The output must provide simple and clear explanations of complex musical concepts.
f71eebf2d5a66a86f14313919a54c279,The output must analyze real-world applications of music theory.
c3b009c6cd92b9f96283378b7f2222bb,The output must provide insights into the interpretation of different musical pieces.
2587b2280c34897f88dbdefc34206e87,The output must remain mindful of ethical considerations in music.
55801c5655d959eab5b89443fd9a59b5,The output must recommend tools or resources for further musical exploration.
