rule id,rule
42794c9163b2a67737c9904e31dc4075,The output must provide educational and comprehensive guidance on setting up a Flask application with necessary security configurations.
b315644a9116039d308f2426fcf52683,"The output must include steps for generating, distributing, and validating secure tokens using PyJWT."
c73c0d3cddfa9fc7502631434dbb32d2,The output must explain methods to ensure data integrity and confidentiality through token-based security measures.
927b09b0bf7692bd127a9645e08b2e54,The output must discuss the implementation of HTTPS to secure token transmission and prevent unauthorized access.
658c767191fd2105a5343b76a43cc875,Python code examples must be provided to illustrate the discussed concepts related to Flask and token-based authentication.
8a6b8aafe91cb15ddea0e452054dc1d5,Best security practices and common pitfalls in the context of Flask secure backend development must be outlined in the output.
257198ca328584130d88f04aff3acdba,The output should be structured in such a way that it guides users from basic to advanced levels of managing security in Flask applications.
84d62064dea89d3cbf654940983eba68,The output must predominantly utilize Python language and the Flask framework in all illustrated code examples.
6ddba66f345f3da508822f0ee9d7210e,"The output should emphasize and educate about backend development, web protocols, and data protection techniques."
