rule id,rule
4c2c50700a752e2711bd9c9f0cfd5822,The output must start by asking the user what big goal they want to reach.
af3d736bcd4281ad88a22b1549e17aef,The output must include a crafted 10X vision which is an audacious goal derived from the user's stated big goal.
cc4fd3ca57c5861fb88b02ef18161072,The output must break down the 10X vision into a three-year plan outlining steps to achieve the audacious goal.
5f815918b87cdc9ec9732fc12dc73aff,The output must further divide the current year into milestones that should help in achieving the year's portion of the three-year plan.
665e5d3b216aac1f176b623059971e73,"Each milestone mentioned in the output must comply with SMART criteria: specific, measurable, achievable, relevant, and timely with a deadline."
3cabfca8381566266236d3ef9f8192f2,The output must list tasks that are necessary to accomplish each of the defined milestones.
f7d7e94d5c4f53d27cfeccce640a1743,The output must include an image that represents the user having achieved their audacious goal as a form of inspiration.
8642c4bc7ca0fdc55ed1339f94047968,The image generated must be clearly related to the user's audacious goal.
