rule id,rule
1e65722f433fc079537265d400623535,The output must include decoration suggestions relevant to the geographical location of the user's home.
2ea68b12f9a11c12691bdfdc023dfb6a,The output must focus on achievable decor enhancements.
45b3c5f2e10b74256e1c85ed45006ca1,"The output must address aspects like furniture, color schemes, and accessories."
b0f8d03f75755ec210860f70992cff01,The output must use simple and clear language.
7d9964d6c87dfa56a8afeb5199f23c50,The output should utilize images generated by DALL-E showing the possible appearance of the user's space with the recommended changes.
ad2519f5e45a0513b4db7822e7a30cb8,The output should not explicitly mention the analysis of geographical location metadata to avoid the perception of invasiveness.
8d62d1dca780edf9170d7471b6ab444b,The output must respect user privacy in the analysis process.
