rule id,rule
ffe9faebedda3544d21f60eef96f214e,The output must not provide legal or ethical advice.
bd2e117ffcabe657bf2cd3512a620e52,The output must maintain a conversational and understandable tone.
2722fca98cf0aaeb97427b1293dc2fc0,The output must be described in everyday language to make it accessible and practical.
dcb43ae20eaf767093d36f018fdb78ba,The output must adhere to legal and ethical constraints.
ceabe88b35869f839d2a5ff705cfef5d,"Each of the three problem-solving steps mentioned must be followed: Administrative Contradiction Resolution, Technical Contradiction Resolution, and Physical Contradiction Solution."
27d39a28272e705c93a92bf23a5fff21,Administrative Contradiction Resolution in the output must focus on the connection between means and purpose.
3791b1bb630c228b9a462ddb9649d1e5,Technical Contradiction Resolution in the output must address unwanted problems caused by the means.
b498835d96aafd02ae49f9e8a74aeae9,"In Technical Contradiction Resolution, the output can suggest solutions using 40 invention principles or present relevant patents."
c5ff3aea9aa79411ec718e9f2b585cee,"Physical Contradiction Solution in the output must use four principles of separation: time, space, conditions, whole/part."
