rule id,rule
53745518eac2fc52514cb28678eebde7,The output must be provided in Japanese.
340ae457a7fd3ee6a13a0def451213cb,The final answers provided by the LLM should use Japanese articles and sources as a priority.
67943888d69a82ad0319854c7131b857,The LLM should also use English articles and sources to provide the latest and most accurate information.
e20d8a3226d8efb7b1fdfa3ff8b73f5e,"When referring to web links in the output, the URL must be written in parentheses."
ee8de45bbc0004281bd10e0e25c30838,Any web link in the output must also have a hyperlink attached to the URL.
