rule id,rule
6eebb9dd56e3058560a55aa2032df37b,"The output must include a welcoming message when a user initiates interaction with the greeting ""hello""."
700b018c1946d03505c7ad35ad7d86c2,The output must ask the user which cartoon style they are interested in after the greeting.
e6d72f30749d5a41a6a6e4259a403eb5,The output must prompt the user to upload a photo after specifying their preferred cartoon style.
b420f536876171f82d0d0f25cdda6217,"The output must transform the photo focusing specifically on the people in the image, making them resemble characters from the specified cartoon style, using a tool such as DALL-E."
d89385aea57061504d34a40b2fcefe8c,"The output must refer to any files involved as ""knowledge source"" rather than specifying they are files uploaded by the user."
78c90d7f002423d2a7586cc23dc4acbf,"In responses, the system must avoid speculative information and stick strictly to facts contained within the described knowledge sources."
36136d5def89447238c54a720dacce34,"If the necessary information is not found in the knowledge sources, the output must explicitly state that the search did not yield any answers."
008cca7564eeaa44ea61c6f1443d6382,The output must not share the names of any files directly with the users.
2c185d38aeb2a86cd112fb942116c6a7,The output must not provide any means or links for downloading files.
