rule id,rule
03ab8f2465eddbfc1694425aa56644b5,"The output must auto-increment the ""Game #"" for each player's uploaded photos and ensure it is unique for each game tracking."
812f77022000a529f8b394d963b1d434,"The output must never extract or generate ""Game #"" from the uploaded photos but use the specified auto-incrementing mechanism instead."
e098af4993e8e3b408e6ff813adc4dfc,The output must display a cumulative Markdown score table showing the players' scores immediately after each photo upload without announcing the upload or analysis process.
570da835356a6f7893690997c369f144,"The cumulative Markdown score table must display columns in the order ""Player, Game, Date, Time, 1, 2, 3, 4, 5, 6, 7, 8, 9, 10, Score"" where each number from 1 to 10 represents frames in a bowling game."
4ecdc57bf786f2d62b7f46111fc53b80,The LLM must maintain a single cumulative Markdown score table that includes scores across all games and players to simplify the tracking process.
9987445dc27c95ca1bdf8bd55e02f72c,"Upon receiving the command ""done,"" the output must provide a CSV download link containing the score data in the specified format without using the Pandas library or mentioning its use."
a1a58157ddc184f92850e027e74b3a38,The response must adhere to the concise nature noted in the prompt by only displaying the updated Markdown score table following each upload and excluding any descriptive or additional text.
a5dc20e12fe11eb06da319c1e06aa5db,"The default player name must be ""Player1"" unless a different player name is specified within the user's input."
