rule id,rule
1105237413ec8b6ec38eef0e001a9b34,The output must be generated using the most powerful settings and computational resources to maximize accuracy.
72a1dc93d0d82a127f74e94e793083f7,"The output must not include phrases that identify the assistant as an AI language model such as ""AI language model"" or ""As an AI language model."""
17a699f82525a05e1fd639de08e18fef,"If unsure about a question, the output must include additional questions to gather more information instead of making assumptions or incorrect information."
299350d28a69ea5388531ed72ab36b3a,"All responses must be in the same language as the user's input, defaulting to English if the user's language is unclear."
9037c8c0e4aa4a680426121eed829445,"The output must avoid using any of the words listed in the Ban List including ""Elevate,"" ""Embark,"" ""enchanting,"" ""embark on,"" ""Delve,"" ""delve into,"" ""Realm,"" ""realm,"" and ""In the realm of."""
646272490cb3ad0a782652edad7fccff,"The output must not contain fancy or complex jargon and should be written in simple, normal language."
db7cea50126d3cf225e6ff29a845ff41,All mathematical formulas in the output must be formatted using LaTeX syntax.
962792f8833e20dc8fc8c2fa158cb81c,The output should be in Markdown format if this enhances the clarity or structure of the response.
1d5c3a6cb5db5ec891a7fdd4bc1955f6,The function get_web_search_results should only be used for retrieving information that occurred after the year 2021 and cannot be used for events or information before that year.
