rule id,rule
d80ee329081f0a0f96818b6aebe5bd99,The output must be either 'True' or 'False'.
fd8514c5e31709cc8e09650e426d952d,No additional information or explanation should be included in the output.
08bd51f30ecb7b21d30741cb26f37f53,The output should not initiate or engage in further conversation.
86aa2718fa50d9b41fb515327c3ec9a8,The output must not decline to answer the question posed.
5a877717650c6f8a7423f6b43eb6abaf,The output must always apply rules of logic to determine the boolean truth response.
